{
  "schemaVersion": "1.0",
  "type": "anchor.scientific-validation-report",
  "reportId": "anchor-scalar-processes-scientific-validation-report",
  "componentId": "scalar-processes",
  "componentLabel": "Scalar Processes",
  "modelId": "anchor.scalar-process-field",
  "modelVersion": "process-pkg-r1",
  "summary": "Scalar Processes has a Pre-Alpha evidence report built from deterministic package fixtures and documented diagnostics.",
  "claims": [
    {
      "version": "1.0",
      "claimId": "scalar-processes.constant-field",
      "componentId": "scalar-processes",
      "title": "Constant field",
      "plainLanguageClaim": "Scalar Processes supports constant field within the deterministic ANCHOR benchmark fixtures.",
      "technicalClaim": "anchor.scalar-process-field constant-field is evaluated by manufactured-solution-or-interpolation-check using fixture-backed deterministic metrics. Status is recorded separately from evidence level.",
      "evidenceLevel": "NUMERICALLY_VERIFIED",
      "methodId": "manufactured-solution-or-interpolation-check",
      "metricId": "manufactured-error-bound",
      "units": "normalized-error",
      "expectedDirection": "less-than-or-equal",
      "threshold": 0,
      "tolerance": 0,
      "thresholdRationale": "Manufactured fixtures should match analytical or interpolation expectations within deterministic numerical tolerance.",
      "fixtureIds": [
        "tests/fixtures/scalar_package_r1_parity.json"
      ],
      "referenceIds": [
        "scalar-process-package-md",
        "homegrown-model-scorecard-md"
      ],
      "applicability": "deterministic-regression, education, and benchmark-suitability review",
      "public": true,
      "claimDigest": "fnv1a32:45567dc3"
    },
    {
      "version": "1.0",
      "claimId": "scalar-processes.linear-x-y-z-t",
      "componentId": "scalar-processes",
      "title": "Linear x/y/z/t interpolation",
      "plainLanguageClaim": "Scalar Processes supports linear x/y/z/t interpolation within the deterministic ANCHOR benchmark fixtures.",
      "technicalClaim": "anchor.scalar-process-field linear-x-y-z-t is evaluated by manufactured-solution-or-interpolation-check using fixture-backed deterministic metrics. Status is recorded separately from evidence level.",
      "evidenceLevel": "NUMERICALLY_VERIFIED",
      "methodId": "manufactured-solution-or-interpolation-check",
      "metricId": "manufactured-error-bound",
      "units": "normalized-error",
      "expectedDirection": "less-than-or-equal",
      "threshold": 0,
      "tolerance": 0,
      "thresholdRationale": "Manufactured fixtures should match analytical or interpolation expectations within deterministic numerical tolerance.",
      "fixtureIds": [
        "tests/fixtures/scalar_package_r1_parity.json"
      ],
      "referenceIds": [
        "scalar-process-package-md",
        "homegrown-model-scorecard-md"
      ],
      "applicability": "deterministic-regression, education, and benchmark-suitability review",
      "public": true,
      "claimDigest": "fnv1a32:ee260951"
    },
    {
      "version": "1.0",
      "claimId": "scalar-processes.multilinear-interpolation",
      "componentId": "scalar-processes",
      "title": "Multilinear interpolation",
      "plainLanguageClaim": "Scalar Processes supports multilinear interpolation within the deterministic ANCHOR benchmark fixtures.",
      "technicalClaim": "anchor.scalar-process-field multilinear-interpolation is evaluated by manufactured-solution-or-interpolation-check using fixture-backed deterministic metrics. Status is recorded separately from evidence level.",
      "evidenceLevel": "NUMERICALLY_VERIFIED",
      "methodId": "manufactured-solution-or-interpolation-check",
      "metricId": "manufactured-error-bound",
      "units": "normalized-error",
      "expectedDirection": "less-than-or-equal",
      "threshold": 0,
      "tolerance": 0,
      "thresholdRationale": "Manufactured fixtures should match analytical or interpolation expectations within deterministic numerical tolerance.",
      "fixtureIds": [
        "tests/fixtures/scalar_package_r1_parity.json"
      ],
      "referenceIds": [
        "scalar-process-package-md",
        "homegrown-model-scorecard-md"
      ],
      "applicability": "deterministic-regression, education, and benchmark-suitability review",
      "public": true,
      "claimDigest": "fnv1a32:67d63a4f"
    },
    {
      "version": "1.0",
      "claimId": "scalar-processes.gaussian-source",
      "componentId": "scalar-processes",
      "title": "Gaussian source fixture",
      "plainLanguageClaim": "Scalar Processes supports gaussian source fixture within the deterministic ANCHOR benchmark fixtures.",
      "technicalClaim": "anchor.scalar-process-field gaussian-source is evaluated by manufactured-solution-or-interpolation-check using fixture-backed deterministic metrics. Status is recorded separately from evidence level.",
      "evidenceLevel": "NUMERICALLY_VERIFIED",
      "methodId": "manufactured-solution-or-interpolation-check",
      "metricId": "manufactured-error-bound",
      "units": "normalized-error",
      "expectedDirection": "less-than-or-equal",
      "threshold": 0,
      "tolerance": 0,
      "thresholdRationale": "Manufactured fixtures should match analytical or interpolation expectations within deterministic numerical tolerance.",
      "fixtureIds": [
        "tests/fixtures/scalar_package_r1_parity.json"
      ],
      "referenceIds": [
        "scalar-process-package-md",
        "homegrown-model-scorecard-md"
      ],
      "applicability": "deterministic-regression, education, and benchmark-suitability review",
      "public": true,
      "claimDigest": "fnv1a32:13223543"
    },
    {
      "version": "1.0",
      "claimId": "scalar-processes.translation-advection",
      "componentId": "scalar-processes",
      "title": "Translation/advection proxy",
      "plainLanguageClaim": "Scalar Processes supports translation/advection proxy within the deterministic ANCHOR benchmark fixtures.",
      "technicalClaim": "anchor.scalar-process-field translation-advection is evaluated by bounded-invariant-and-diagnostic-check using fixture-backed deterministic metrics. Status is recorded separately from evidence level.",
      "evidenceLevel": "PHYSICALLY_PLAUSIBLE",
      "methodId": "bounded-invariant-and-diagnostic-check",
      "metricId": "bounded-plausibility-invariant",
      "units": "pass-count",
      "expectedDirection": "less-than-or-equal",
      "threshold": 0,
      "tolerance": 1,
      "thresholdRationale": "The threshold is a deterministic regression gate for bounded synthetic behavior; it is not an oceanographic validation threshold.",
      "fixtureIds": [
        "tests/fixtures/scalar_package_r1_parity.json"
      ],
      "referenceIds": [
        "scalar-process-package-md",
        "homegrown-model-scorecard-md"
      ],
      "applicability": "deterministic-regression, education, and benchmark-suitability review",
      "public": true,
      "claimDigest": "fnv1a32:888b888e"
    },
    {
      "version": "1.0",
      "claimId": "scalar-processes.diffusion-spread",
      "componentId": "scalar-processes",
      "title": "Diffusion spread proxy",
      "plainLanguageClaim": "Scalar Processes supports diffusion spread proxy within the deterministic ANCHOR benchmark fixtures.",
      "technicalClaim": "anchor.scalar-process-field diffusion-spread is evaluated by bounded-invariant-and-diagnostic-check using fixture-backed deterministic metrics. Status is recorded separately from evidence level.",
      "evidenceLevel": "PHYSICALLY_PLAUSIBLE",
      "methodId": "bounded-invariant-and-diagnostic-check",
      "metricId": "bounded-plausibility-invariant",
      "units": "pass-count",
      "expectedDirection": "less-than-or-equal",
      "threshold": 0,
      "tolerance": 1,
      "thresholdRationale": "The threshold is a deterministic regression gate for bounded synthetic behavior; it is not an oceanographic validation threshold.",
      "fixtureIds": [
        "tests/fixtures/scalar_package_r1_parity.json"
      ],
      "referenceIds": [
        "scalar-process-package-md",
        "homegrown-model-scorecard-md"
      ],
      "applicability": "deterministic-regression, education, and benchmark-suitability review",
      "public": true,
      "claimDigest": "fnv1a32:f4922630"
    },
    {
      "version": "1.0",
      "claimId": "scalar-processes.exponential-decay",
      "componentId": "scalar-processes",
      "title": "Exponential decay",
      "plainLanguageClaim": "Scalar Processes supports exponential decay within the deterministic ANCHOR benchmark fixtures.",
      "technicalClaim": "anchor.scalar-process-field exponential-decay is evaluated by manufactured-solution-or-interpolation-check using fixture-backed deterministic metrics. Status is recorded separately from evidence level.",
      "evidenceLevel": "NUMERICALLY_VERIFIED",
      "methodId": "manufactured-solution-or-interpolation-check",
      "metricId": "manufactured-error-bound",
      "units": "normalized-error",
      "expectedDirection": "less-than-or-equal",
      "threshold": 0,
      "tolerance": 0,
      "thresholdRationale": "Manufactured fixtures should match analytical or interpolation expectations within deterministic numerical tolerance.",
      "fixtureIds": [
        "tests/fixtures/scalar_package_r1_parity.json"
      ],
      "referenceIds": [
        "scalar-process-package-md",
        "homegrown-model-scorecard-md"
      ],
      "applicability": "deterministic-regression, education, and benchmark-suitability review",
      "public": true,
      "claimDigest": "fnv1a32:d7931bcd"
    },
    {
      "version": "1.0",
      "claimId": "scalar-processes.source-plus-decay",
      "componentId": "scalar-processes",
      "title": "Source plus decay",